{
  "$schema": "http://json-schema.org/draft-07/schema#",
  "$id": "https://github.com/KevinRabun/judges/blob/main/judgesrc.schema.json",
  "title": "Judges Panel Configuration",
  "description": "Configuration schema for .judgesrc / .judgesrc.json files used by the Judges Panel CLI.",
  "type": "object",
  "properties": {
    "$schema": {
      "type": "string",
      "description": "JSON Schema reference for IDE validation."
    },
    "preset": {
      "type": "string",
      "description": "Named preset or comma-separated composition (e.g. \"security-only\" or \"security-only,performance\"). Individual settings override preset values."
    },
    "disabledRules": {
      "type": "array",
      "items": { "type": "string" },
      "description": "Rule IDs to suppress entirely (e.g. [\"SEC-003\", \"COST-001\"])."
    },
    "disabledJudges": {
      "type": "array",
      "items": { "type": "string" },
      "description": "Judge IDs to skip during evaluation (e.g. [\"accessibility\", \"documentation\"])."
    },
    "minSeverity": {
      "type": "string",
      "enum": ["critical", "high", "medium", "low", "info"],
      "description": "Minimum finding severity to report. Anything below this threshold is filtered out.",
      "default": "info"
    },
    "languages": {
      "type": "array",
      "items": { "type": "string" },
      "description": "Languages to restrict analysis to. When empty, all languages are analyzed."
    },
    "ruleOverrides": {
      "type": "object",
      "additionalProperties": {
        "type": "object",
        "properties": {
          "disabled": {
            "type": "boolean",
            "description": "Disable this specific rule."
          },
          "severity": {
            "type": "string",
            "enum": ["critical", "high", "medium", "low", "info"],
            "description": "Override the default severity for this rule."
          }
        },
        "additionalProperties": false
      },
      "description": "Per-rule overrides keyed by rule ID or wildcard prefix (e.g. \"SEC-*\")."
    },
    "failOnFindings": {
      "type": "boolean",
      "description": "Exit with code 1 when the verdict is fail. Useful for CI pipelines.",
      "default": false
    },
    "baseline": {
      "type": "string",
      "description": "Path to a baseline JSON file. Findings matching the baseline are suppressed."
    },
    "format": {
      "type": "string",
      "enum": ["text", "json", "sarif", "markdown", "html", "junit", "codeclimate"],
      "description": "Default output format.",
      "default": "text"
    },
    "exclude": {
      "type": "array",
      "items": { "type": "string" },
      "description": "Glob patterns to exclude files from analysis (e.g. [\"**/*.test.ts\", \"**/fixtures/**\"])."
    },
    "include": {
      "type": "array",
      "items": { "type": "string" },
      "description": "Glob patterns to include only matching files (e.g. [\"**/*.py\", \"**/*.ts\"]). When specified, only matching files are analyzed."
    },
    "maxFiles": {
      "type": "integer",
      "minimum": 1,
      "description": "Maximum number of files to analyze when scanning a directory.",
      "default": 300
    },
    "plugins": {
      "type": "array",
      "items": { "type": "string" },
      "description": "Plugin module specifiers (npm packages or relative file paths) that export custom JudgeDefinition arrays. Each module must export { judges: JudgeDefinition[] } or a default export."
    },
    "regulatoryScope": {
      "type": "array",
      "items": {
        "type": "string",
        "enum": ["GDPR", "CCPA", "HIPAA", "PCI-DSS", "SOC2", "SOX", "COPPA", "FERPA", "FedRAMP", "NIST", "ISO27001", "ePrivacy", "DORA", "NIS2", "EU-AI-Act", "LGPD", "PIPEDA"]
      },
      "description": "Regulatory frameworks in scope for this project. Findings citing ONLY out-of-scope frameworks are suppressed. If omitted, all regulatory findings are reported."
    },
    "consensusThreshold": {
      "type": "number",
      "minimum": 0,
      "maximum": 1,
      "description": "Consensus suppression threshold (0-1). If this fraction of judges report zero findings, minority findings are suppressed. Recommended: 0.7 (moderate), 0.8 (conservative). If omitted, no consensus suppression is applied."
    }
  },
  "additionalProperties": false
}
